<xs:schema xmlns:xs="http://www.w3.org/2001/XMLSchema">

  <xs:element name="pedidos">
    <xs:complexType>
      <xs:sequence>
        <xs:element name="pedido">
          
          <xs:complexType>
            <xs:sequence>
              
              <xs:element name="cliente">
                <xs:complexType>
                  <xs:sequence>
                    <xs:element name="nombre" type="xs:string"/>
                    
                    
                    <xs:element name="email">
                      <xs:simpleType>
                        <xs:restriction base="xs:string">
                          <xs:pattern value=".+@.+\..+"/>
                        </xs:restriction>
                      </xs:simpleType>
                    </xs:element>

                    
                    <xs:element name="telefono">
                      <xs:simpleType>
                        <xs:restriction base="xs:string">
                          <xs:pattern value="\d{3}-\d{3}-\d{3}"/>
                        </xs:restriction>
                      </xs:simpleType>
                    </xs:element>
                  </xs:sequence>
                </xs:complexType>
              </xs:element>

             
              <xs:element name="productos">
                <xs:complexType>
                  <xs:sequence>
                    <xs:element name="producto" maxOccurs="unbounded">
                      <xs:complexType>
                        <xs:sequence>
                          <xs:element name="nombre" type="xs:string"/>
                          
                    
                          <xs:element name="precio">
                            <xs:simpleType>
                              <xs:restriction base="xs:decimal">
                                <xs:minExclusive value="0"/>
                              </xs:restriction>
                            </xs:simpleType>
                          </xs:element>

                          <xs:element name="cantidad" type="xs:integer"/>
                        </xs:sequence>
                      </xs:complexType>
                    </xs:element>
                  </xs:sequence>
                </xs:complexType>
              </xs:element>

              
              <xs:element name="estado">
                <xs:simpleType>
                  <xs:restriction base="xs:string">
                    <xs:enumeration value="Pendiente"/>
                    <xs:enumeration value="Enviado"/>
                    <xs:enumeration value="Entregado"/>
                  </xs:restriction>
                </xs:simpleType>
              </xs:element>
            </xs:sequence>

          
            <xs:attribute name="codigo" use="required">
              <xs:simpleType>
                <xs:restriction base="xs:string">
                  <xs:pattern value="A\d{3}"/>
                </xs:restriction>
              </xs:simpleType>
            </xs:attribute>
          </xs:complexType>
        </xs:element>
      </xs:sequence>
    </xs:complexType>
  </xs:element>

</xs:schema>